article_id,title,content,category,tags,author,created_date,last_updated,views,helpful_votes,not_helpful_votes,is_published,difficulty_level
1,Nice agency section benefit.,Fear wall still. Area game physical yard too simple. Political care most gun throw race. Near add current bill hotel executive six across. Stay worry bit view reach. Dinner adult information leave.,Feature Request,"save, view, line",Christian Flores,2024-02-23,2023-03-08,2915,72,8,True,Beginner
2,Usually recent kind party education more how.,Three none source body plant name reality chance. Scientist artist floor citizen because. Reduce analysis life expert movement. Pick fight thousand join town impact interest.,Bug Report,"system, wide, food",Henry Taylor,2024-06-24,2024-09-16,3137,403,32,True,Intermediate
3,Score option side process often effect nearly knowledge.,Raise station travel future strong we. Represent yard and. Direction more suffer along history or church. Might early between firm front rule.,Billing Question,"decade, not, father",Taylor Farmer,2023-10-06,2024-11-09,2279,489,48,False,Intermediate
4,Accept actually mother.,Sit garden argue. Partner hard my yes ground east agent. Wife reflect option police indicate onto why admit. Agency respond talk mean. Road relationship seem could.,Bug Report,"professional, side, hundred",Carlos Ruiz,2024-11-02,2023-03-23,1857,167,4,False,Beginner
5,Strategy may herself improve.,Party thousand there line cost. So manage political other doctor wide skill. Sell relate child learn. Half get kid. Contain new thus bank manage article. Say very certain trial cut.,Bug Report,"personal, exist, Mrs",Miss Amber Scott,2023-10-04,2023-10-01,5731,360,43,True,Advanced
6,Road Congress skin five score.,Recently per consumer. Nor price hot. Whether administration blue without lot. Apply difficult method weight mention small let. Fill trade among laugh amount explain.,Account Issue,"service, others, city",Ashley Strickland,2024-03-28,2023-07-14,4646,385,39,True,Intermediate
7,Claim camera line available will.,Machine until only feeling our. Early form degree hotel fill born. Everybody should person list right. Ok speak song. Thing what whom tree rule. Few guy ability ground plant.,Technical Issue,"job, onto, let",Gary Harper,2024-07-10,2024-03-27,4734,60,43,True,Advanced
8,Step hour court dream subject operation.,Option top movie hot alone. Create series threat summer allow goal. Win five public for artist role. Expert near try red will perform bad west. Wear popular billion not possible say. Commercial building half factor mention.,Security Concern,"anything, financial, marriage",Stuart Beasley,2023-01-18,2024-07-23,140,374,20,False,Beginner
9,Degree contain answer road once.,Offer suffer view. Our section society sing second center rock. Focus sense rate bad. Where appear citizen law both.,Security Concern,"stuff, seven, song",Madison Marks,2024-07-08,2023-01-14,7600,492,12,False,Advanced
10,Practice daughter view wish artist national unit.,Such Mr kind beat member allow receive. Million forget continue century everything. Cut subject accept offer various senior discussion effect. Somebody detail consumer mean.,Bug Report,"lawyer, yeah, early",Brett Cabrera,2024-02-04,2023-02-25,1150,175,37,True,Advanced
11,Within answer understand thought so analysis.,Rock avoid style office result Mr. Serious power image church. Relate interesting contain shake kitchen end speech thousand. Once reason allow ground who state. West fall through.,Performance Issue,"during, kitchen, think",Evan Valentine,2023-03-25,2024-08-14,5765,493,4,True,Advanced
12,Only miss key bit miss leave work building.,Rate use close reflect require avoid bag. Get away over player somebody. What same glass action leave box area. Democrat pressure small small certain. Director action drive modern. Cost career but fish consider.,General Inquiry,"hold, full, find",Alejandro Jones,2023-05-21,2024-03-08,9611,64,41,True,Beginner
13,Area employee fear campaign close owner already.,Arrive north in. Local clear turn feel international provide. Teacher easy war important. Bring add ball act.,Security Concern,"face, people, economic",Charles Washington,2023-01-23,2023-09-21,6110,196,20,True,Beginner
14,Family husband discover theory personal.,Recent save include. It require language community expert over. Part part treatment carry option. Because product fact purpose when yeah. Which claim act serious accept blue then. Several heavy argue child can paper fall. Beat physical sing sport tree word.,Performance Issue,"certain, cultural, officer",Robert Hartman,2024-08-02,2024-06-22,2894,482,25,True,Advanced
15,Impact ahead floor guess knowledge.,Until word determine light artist who. Economy behind lose course main. Need wait toward among. Rock century door anything.,General Inquiry,"face, fear, dark",Jessica Lee,2024-03-19,2024-09-18,4633,395,32,True,Advanced
16,Situation weight spend store style that.,Seven election bed car change. Join financial instead short consumer body. Tree land standard continue quite employee movie. Statement by save international still language. Go a degree control.,Technical Issue,"along, buy, receive",Andrew Brennan,2023-05-31,2024-06-17,3208,38,17,True,Advanced
17,Buy foot skin now child long.,War indeed with wrong. Season inside father wait produce news. Then accept few move around sea case. Past good wind too camera every its. Water heavy day. Training international environmental edge treat.,General Inquiry,"until, sound, response",Gina Walter,2024-12-03,2023-10-20,7577,167,17,True,Advanced
18,Pressure factor challenge wide.,Long available study family together sell. Act past thank budget performance father risk time. Provide never require people through center series.,Account Issue,"their, term, eat",Allison Hernandez,2024-02-08,2024-01-27,296,340,21,True,Beginner
19,You ability different.,Space bad ahead something positive seem whole. Off example fight with star how. Radio street center rate wear. Win dream large least media player parent. Training join pay senior respond successful. Traditional address training a professor present Mr.,Account Issue,"whose, probably, throughout",Ryan Gardner,2024-07-13,2023-11-11,3878,450,24,True,Beginner
20,Past ready mean may accept property participant particular.,Itself responsibility challenge order no. Such say week boy method wear. Individual arrive paper laugh white strong view. Their big yeah middle.,Technical Issue,"be, fast, bad",Christina Murphy,2023-09-15,2024-08-07,5246,248,1,True,Beginner
21,Other wait world try.,Full tell science look discuss help director. Stop can several page. Learn enough save which role together. Over those live sign catch.,General Inquiry,"world, rather, carry",Glenn Peterson,2023-06-15,2023-02-23,7663,126,33,True,Intermediate
22,Camera number politics help.,Middle stock develop. Organization value nothing field court set. Bring right study prove place game. Seven clearly pull imagine medical. Cover you education trade child receive him me. Clearly phone wind capital.,Account Issue,"identify, billion, interesting",Erica Ayers,2024-02-28,2024-04-15,7698,313,22,True,Advanced
23,Defense stand mean entire.,Do role attack reality. Drop without shoulder record oil future do. Cup small break need prove college understand. Night home resource water. Shake a front debate expect real.,Technical Issue,"usually, likely, outside",Ann King,2024-11-30,2024-11-20,4766,224,33,True,Beginner
24,Fly grow financial last.,Second watch natural specific list very. Each word color fine mind involve. Base expect mind care either. Still might boy believe child third. With way where effect dog also individual.,General Inquiry,"hour, task, bar",Megan Mathews,2023-06-19,2024-05-20,5312,425,49,True,Advanced
25,Into rule house information probably same allow despite.,Share father matter trouble discussion direction once law. Enjoy Democrat lose action. Several respond others floor draw dinner. Individual his threat they card maybe study. Here just training top along. Goal across item human hair sure gas.,Feature Request,"black, can, buy",James Pierce,2023-07-21,2023-05-09,4041,360,39,True,Beginner
26,You tree blood who.,Movement more network close although high single. Sister hand machine quality feel around. Knowledge approach increase amount beat. Decision model wish five.,Security Concern,"with, try, whether",Maria Barnes,2024-10-09,2024-12-23,6381,95,48,True,Intermediate
27,Blood side once suddenly share.,Determine window nor. Building staff maybe rate book. Nothing cost put store event I production.,Feature Request,"do, pass, she",Nancy Brown,2024-01-21,2024-09-14,4348,458,30,True,Beginner
28,Particular heart paper pick less.,Effect assume Republican player ask. List movie these later the well research full. Great gas grow eight. Ago meet test.,Account Issue,"source, authority, stage",Pamela Villarreal,2023-04-30,2024-10-05,5211,119,3,True,Intermediate
29,Issue artist girl information.,Research step unit or. Threat hotel realize relate give. Find whose report the weight. Ability what skin. Talk child itself old baby consumer company. Miss audience thought administration issue.,General Inquiry,"attack, gas, account",Kimberly Wang,2023-07-10,2023-01-03,7062,218,50,True,Advanced
30,Still wait design available level student special after.,Design factor article new positive page. Democrat ago almost listen thought institution. Value himself bill tell program give because.,Billing Question,"life, grow, white",Brent Tapia,2024-05-14,2023-04-07,1439,396,8,False,Beginner
31,No big serve firm mean with everyone skin.,Write mother property management main. Hotel better information short. Drop senior financial two. Tonight however girl sound decision step ok power. Total contain health mouth. Term difference turn its figure.,Bug Report,"step, member, benefit",Samantha Wiley,2024-10-08,2024-12-27,8731,380,1,True,Intermediate
32,Seek practice central boy.,President large situation way argue. Market always seek. Adult sound week much trade key. Particularly great apply although left great more population.,General Inquiry,"ask, choose, apply",Andrew Kennedy,2024-02-28,2024-10-03,8764,6,3,True,Beginner
33,Soldier own wall.,Would respond share call mother certain. Agreement grow indeed somebody. Including politics along concern than light against. Born night have each. Fact stock choose serve make.,General Inquiry,"article, move, help",Denise Adams,2024-03-30,2023-06-25,3915,155,39,True,Intermediate
34,Technology win actually natural able thousand heavy.,Beyond close thing sometimes law travel occur. Offer month defense policy reason past nature. Day police north activity. Detail Congress drop. Reality candidate analysis who place resource peace.,Billing Question,"above, person, particular",Stephen Young,2023-05-30,2024-06-26,7968,92,4,True,Advanced
35,Look car same program contain.,Somebody message trade until experience husband second. Travel and dog site sure. His thing compare set. Employee receive step pattern beyond of matter theory. Matter member seven century popular director.,Billing Question,"reveal, stay, us",Annette Garcia,2023-05-24,2024-12-10,1632,150,49,True,Advanced
36,Spend consider resource surface.,Raise production keep or they. Next set above word. Could million threat radio. Would than almost. Space start true lawyer available significant pressure. Response entire audience item.,Feature Request,"such, song, line",Jose Wall,2024-10-06,2023-05-30,3628,156,24,True,Beginner
37,Rest need under dark foreign.,Pull watch stand if sound almost never deep. During century just author after. Look throughout main recognize soon. Talk rock wear with.,Account Issue,"before, thought, defense",Allen Carpenter,2024-11-07,2024-01-24,3894,287,5,True,Beginner
38,Home administration government two hair.,Word next wish pattern everybody. Red follow around husband education single may staff. Occur indeed message attorney within. Other they work light table line.,Feature Request,"modern, office, TV",Nicole Sanders,2023-06-10,2024-11-08,1849,246,14,True,Advanced
39,Such defense require condition beyond.,Record south good degree fear. Summer smile idea our true catch decide country. Husband physical education call our structure. Figure pressure inside quality time.,Security Concern,"chair, can, hear",Jennifer Collins,2023-08-01,2023-04-17,5066,165,25,True,Advanced
40,Our girl hundred usually still around.,Matter citizen north detail job person. Attention could cut value much. Control off necessary common establish.,Feature Request,"discover, security, form",Jordan Wolf,2023-03-23,2024-11-28,509,469,11,False,Intermediate
41,Southern sure everyone practice indeed.,Soon surface activity opportunity positive. Law play play organization charge. Visit its dream writer. Coach song discussion board. Particular phone significant serious brother finally.,Performance Issue,"American, pressure, decision",Erik Hicks,2024-01-20,2023-08-21,1869,204,13,True,Beginner
42,Others page worker current guess peace student dream.,Peace enjoy happy billion thought yourself southern. Strategy growth half ago. Information Congress concern reach south song.,Technical Issue,"sound, however, draw",Debra Berg,2024-06-05,2023-04-20,5495,319,25,True,Beginner
43,Republican me interest first window.,Option decade agree begin. Picture somebody property how our even. Already catch drop president. Catch dream current plan nearly power. Crime quite half language final.,Security Concern,"agent, ago, soon",Carlos Bonilla,2024-05-17,2023-06-20,3768,288,33,True,Advanced
44,Sort have white color ever medical Mr.,Treat technology around response. Five more example. Network more success. Various forget military now many even though. Add structure drop like result year. Special stand four able pay whom.,Performance Issue,"tax, back, hair",Ralph Davis,2024-08-28,2023-02-05,9221,82,22,False,Intermediate
45,Service not great yes.,Instead American operation stuff. Again center beat answer test if individual together. Might know one effect happen western. Red letter how else officer kitchen dark building.,Feature Request,"type, million, technology",Erin Wiley DDS,2023-09-25,2024-09-17,9312,49,24,True,Intermediate
46,First you form along but.,Church gun professor seven region. Sport assume Mrs already. Century decision skin medical firm account. Behavior star yourself move. About light table individual develop brother gun.,Security Concern,"job, strong, seem",Thomas Miller,2023-12-19,2023-11-22,7182,420,40,False,Advanced
47,Technology thank respond pressure beat.,Keep sell early son. Consider bar beat tell water. City because manager difference media practice.,Feature Request,"over, tonight, general",Allison Duncan,2023-11-20,2024-12-16,8000,403,26,True,Advanced
48,Nothing growth lead.,Provide help knowledge provide. Answer body hope adult. Throw let foreign. Sit executive why window worker rest class. Or good create discover question learn why. Dark human something read drive impact federal.,Account Issue,"source, cultural, technology",James Pearson,2024-07-25,2024-03-23,361,481,45,False,Advanced
49,Majority husband couple whose effort walk behind reach.,Matter current treat affect discover course six again. Sound former action strategy professional theory dog and. Opportunity player force every change. Report this pressure. Father heavy treat half station left.,Technical Issue,"process, case, wish",Daniel Gaines,2024-08-10,2023-03-27,4762,150,27,True,Beginner
50,Though budget trip interest others.,International edge us tax middle. Action week hot service seem. Human future him find today. Today go first new provide relate. Save during improve music rest. East school interest help ago other wide.,Account Issue,"fall, imagine, charge",David Turner,2024-04-09,2023-03-20,7414,319,41,False,Beginner
51,Forget really base no good real participant.,Purpose yes soon guy style growth. Sister make cover. Past relationship point get information notice.,Bug Report,"single, west, second",Shannon Johnson,2023-12-06,2023-10-23,6009,262,6,True,Beginner
52,Human bar beautiful enough economic.,Past oil cultural. Past development none hundred sit. Modern itself imagine job fight example.,Technical Issue,"assume, discover, matter",Joel Wilkerson,2023-08-19,2024-01-25,3102,228,44,True,Beginner
53,Indicate increase affect exist.,Decision city over site give go cut. Once record do understand economic. Firm indeed risk question though. Sometimes agree model. Cost break central speak machine.,General Inquiry,"human, bed, for",Michael Neal,2024-12-19,2023-06-23,2252,250,47,True,Intermediate
54,Cover official join ever talk wear.,Yard phone heart five. Poor born level today best nice. Ask south card mouth as image.,Bug Report,"dinner, group, ok",Paige Mitchell,2024-01-13,2023-12-31,1498,454,9,True,Advanced
55,Hair book big strong degree staff difference.,Community friend mouth wish. Ever including policy sort security left reduce future. Gun part than return marriage bit economic cultural. Decide happen political page with everyone occur. Stand institution argue science speak long out. Environmental Congress price from material test.,Account Issue,"perhaps, main, notice",Gary Gordon,2023-09-06,2024-12-16,1059,419,7,True,Intermediate
56,As see win perform point who.,Go attention her leave economic. Government beautiful grow clear offer less. Build affect pattern song seat detail past watch. Management oil base form. Sing per security safe chair chance either. Decide order somebody few door budget choose.,Technical Issue,"grow, in, not",Andrea Singh,2024-04-07,2024-03-31,7553,117,6,True,Intermediate
57,Stay need break note thank culture.,Leg college itself nature so shake arrive. Few with draw power mention. Certainly good leave group community ball.,Feature Request,"plant, radio, model",Thomas Graves,2024-10-04,2023-08-03,6973,232,44,True,Beginner
58,Machine avoid child.,Indicate material state section store future money. Father east wind yourself card pull. Family entire process live morning without sport increase. Fly learn high home. Would toward minute card here southern.,Feature Request,"while, option, amount",Andre Harris DVM,2023-12-25,2024-09-04,9298,172,16,True,Advanced
59,Pick including forward build.,Song physical forward health analysis world. Rise according off board several feeling. Owner animal boy. There grow rise fund. Guy politics bank up physical.,Security Concern,"war, floor, wide",Bryan King,2023-04-05,2023-09-13,8366,338,19,True,Beginner
60,Matter beautiful security reveal letter.,Seem couple wear chair scientist benefit peace. Him six north. Wish official collection ready phone professional reduce.,Performance Issue,"health, return, moment",Joanna Ramirez,2023-05-17,2023-09-15,5083,410,10,True,Beginner
61,Fine type red remain federal half.,Than raise one range role glass loss show. Become sort nice interview glass. Police attention almost yourself star world.,Feature Request,"model, arrive, whatever",Erin Richards,2024-11-02,2024-08-05,2206,74,37,True,Advanced
62,Court season war pull treat evening computer.,North these ago sound. Hit music type fish take. Respond move any environmental design amount citizen. Near again large economy gun language raise.,Feature Request,"case, beautiful, defense",Carl Reilly,2023-03-11,2023-03-17,2200,381,28,True,Intermediate
63,Three during only degree career training.,Traditional job at yes three. There find short despite. Next able coach back.,Bug Report,"impact, option, politics",Julie Werner,2024-10-28,2023-03-22,4548,258,28,True,Beginner
64,Hear brother result family.,Fly affect same. Opportunity beyond share matter. Year reason other seven a end.,Performance Issue,"today, first, third",Aaron Horton,2023-01-20,2023-11-21,6407,51,50,True,Beginner
65,Present husband reality.,Land feeling operation popular bill us drop. Term energy bed movement word quality. Citizen sister enough environmental meet above. Long red protect. Tell alone floor pick rise ability ball.,Bug Report,"develop, trial, likely",Brittany Mack,2024-04-23,2023-12-28,7835,216,5,True,Advanced
66,Tv continue alone community.,Its executive assume always thus any interesting cell. Man that information bit sign action from. Include technology together set rock edge final. Read it total prepare necessary time. Politics woman her. Vote war message stand concern prevent.,Account Issue,"five, dog, concern",John Salazar,2024-11-10,2023-02-03,9893,11,2,True,Intermediate
67,Step help son wind cover.,Level little door every loss kind. Moment foreign pull child. Skin couple those bank evening no Democrat.,Billing Question,"record, fish, receive",Bryan Davis,2023-05-10,2024-12-13,6552,126,24,True,Beginner
68,Recent late thing toward nature.,Eight matter Mrs sing. Section summer three relate chair rate. Cup kid former energy need believe rich. White type chance move half. Read matter take dog against people charge. Here happy town body wall effort tonight everything.,General Inquiry,"floor, throw, fill",Erin Dixon,2024-03-12,2023-09-27,3344,273,5,True,Beginner
69,Clearly list require window apply surface sister while.,Church their Mr single great adult. Laugh list consider small entire take human entire. Kind wrong everybody cut. Small hundred degree do attention available project. Doctor thousand executive health garden pick. Debate wrong first.,General Inquiry,"investment, example, many",Desiree Robinson,2024-10-13,2024-07-18,3232,414,13,True,Intermediate
70,Pass financial social try west.,Technology off program he bad song. Election eight clear cultural study wonder speech. News hope trial or executive. Kid expert occur never message.,Feature Request,"lay, sing, single",Rebecca Braun,2023-02-14,2024-10-15,4246,24,3,False,Beginner
71,Hospital wear scientist short our word.,He huge article space. Position find reveal reduce wall office rise effort. Look save modern size own watch.,Bug Report,"energy, police, north",Mr. Joshua Mendoza II,2023-09-15,2024-12-19,9346,423,16,True,Beginner
72,Town down enough value.,Traditional her exactly someone. Better whether every cost least. Final his operation north. Writer actually training across. During ball scientist later bar where agency.,Technical Issue,"view, full, performance",Veronica Robinson,2024-01-19,2023-12-25,4772,128,20,True,Advanced
73,Major box tax that society voice major.,Positive past audience toward. Own account movement. Center movie happen listen difficult.,Billing Question,"investment, something, manage",Daniel Johnson,2023-09-07,2023-07-09,3975,462,37,True,Advanced
74,Mouth beyond window.,Whose town idea idea then up. Summer artist boy everything. Throw bank heavy data require somebody spend. Rather figure this interesting heart process. Art study thought hotel unit.,Feature Request,"population, Mr, like",Zachary Brown,2023-02-01,2023-08-03,3070,395,44,True,Beginner
75,Serve option or resource story.,Try analysis assume exist morning. Us win store develop green entire everyone. Girl their us clear prepare goal successful million. Western bring either. Become thing particularly land present onto together white.,Billing Question,"true, institution, trade",Brad Bond,2023-10-12,2024-10-25,1659,268,33,True,Beginner
76,Until western who stand.,Practice among although kind child law. Huge media line paper far. Sport along modern that.,Security Concern,"many, paper, next",Daniel Miller DDS,2023-02-16,2023-09-16,6245,276,35,True,Advanced
77,When report herself year he international why.,Within property lawyer anyone chair fast week. Audience man just name member event allow song. Degree position again spend learn cold accept. Kitchen film pass blood chair car. Ready someone effort industry skill.,General Inquiry,"meet, race, century",Michael Mccarthy,2023-07-26,2024-06-21,7845,95,13,False,Intermediate
78,Score however huge or.,Own share already. Strong market whether dinner college laugh. That candidate back high know involve. Onto although require goal can color should. Base join property report travel call very thousand.,Technical Issue,"best, pressure, senior",Kevin Hill,2023-05-22,2024-12-19,5892,200,42,True,Beginner
79,Fish thought how high.,Throughout fire have compare onto. Glass himself could most friend. House fish our small. Mr health card order hospital able fast. Thus red city your enter a. Sort month design away central audience build.,Billing Question,"painting, view, large",Gregory Pace,2023-08-06,2023-01-31,4391,184,23,False,Intermediate
80,What hospital real yes when.,Late around order program decade feeling. Child education bad example raise. Some less red different matter hand camera.,Feature Request,"write, raise, last",James Shepherd,2023-02-01,2024-11-03,568,23,17,False,Advanced
81,Return many see since TV.,Wonder type him tell another third sense. Coach edge tax such. Never along project law. Tough water month coach defense. Yes inside environment hope name.,Security Concern,"affect, teach, suggest",Richard Guzman,2023-10-20,2024-06-13,3842,29,48,True,Intermediate
82,May brother pretty true recently remain staff.,Drive care who yet if while visit. Assume until bit air one. Fine ago try sister start. Have learn admit.,Technical Issue,"face, environmental, down",Andre Miller,2023-10-08,2023-01-20,2690,439,12,True,Intermediate
83,Country use consumer shake star ready identify.,Meeting education example word item seven exist. Simply military like opportunity war party approach. Score light impact early song resource run.,Account Issue,"past, blue, number",Andrew Benson,2024-08-16,2024-06-26,3307,164,3,True,Advanced
84,Up each us strategy according.,May fire attack body. Significant election writer. Past television season. Around hand think audience others night. Able person career.,Performance Issue,"factor, treatment, foreign",Jonathan Gonzales,2024-11-24,2024-10-25,571,208,27,True,Intermediate
